{
  "$schema":"http://json-schema.org/draft-04/schema#",
  "type":"object",
  "properties":{
    "codes":{
      "type":"array",
      "items":{
        "oneOf":[
          {
            "oneOf":[
              {
                "type":"object",
                "properties":{
                  "type":{
                    "type":"string",
                    "enum":[
                      "SINGLE"
                    ]
                  },
                  "code":{
                    "type":"integer"
                  },
                  "missable":{
                    "type":"boolean",
                    "enum":[
                      false
                    ]
                  }
                },
                "required":[
                  "type",
                  "code",
                  "missable"
                ],
                "additionalProperties":false
              },
              {
                "type":"object",
                "properties":{
                  "type":{
                    "type":"string",
                    "enum":[
                      "SINGLE"
                    ]
                  },
                  "code":{
                    "type":"integer"
                  }
                },
                "required":[
                  "type",
                  "code"
                ],
                "additionalProperties":false
              }
            ]
          },
          {
            "type":"object",
            "properties":{
              "type":{
                "type":"string",
                "enum":[
                  "RANGE"
                ]
              },
              "min_value":{
                "type":"integer"
              },
              "max_value":{
                "type":"integer"
              },
              "missable":{
                "type":"boolean"
              }
            },
            "required":[
              "type",
              "min_value",
              "max_value",
              "missable"
            ],
            "additionalProperties":false
          }
        ]
      },
      "minItems":1
    },
    "comment":{
      "type":"string"
    },
    "startcode":{
      "type":"integer"
    },
    "stopcode":{
      "type":"integer"
    },
    "rewardcode":{
      "type":"integer"
    }
  },
  "required":[
    "codes",
    "startcode",
    "stopcode",
    "rewardcode"
  ],
  "additionalProperties":false
}