{
  "comment":"trial template for 3ec_xxx tm file and images cnd file",
  "startcode":9,
  "stopcode":18,
  "rewardcode":96,
  "codes":[
    {
      "code":9,
      "type":"SINGLE"
    },
    {
      "code":10,
      "type":"SINGLE"
    },
    {
      "code":15,
      "type":"SINGLE"
    },
    {
      "code":100,
      "type":"SINGLE"
    },
    {
      "code":16,
      "type":"SINGLE"
    },
    {
      "missable":false,
      "max_value":192,
      "min_value":192,
      "type":"RANGE"
    },
    {
      "missable":true,
      "max_value":208,
      "min_value":192,
      "type":"RANGE"
    },
    {
      "code":23,
      "type":"SINGLE"
    },
    {
      "code":8,
      "type":"SINGLE"
    },
    {
      "code":25,
      "type":"SINGLE"
    },
    {
      "code":26,
      "type":"SINGLE"
    },
    {
      "code":27,
      "type":"SINGLE"
    },
    {
      "code":28,
      "type":"SINGLE"
    },
    {
      "code":29,
      "type":"SINGLE"
    },
    {
      "code":30,
      "type":"SINGLE"
    },
    {
      "missable":false,
      "max_value":124,
      "min_value":121,
      "type":"RANGE"
    },
    {
      "code":120,
      "type":"SINGLE"
    },
    {
      "code":8,
      "type":"SINGLE"
    },
    {
      "code":24,
      "type":"SINGLE"
    },
    {
      "code":17,
      "type":"SINGLE"
    },
    {
      "code":0,
      "type":"SINGLE"
    },
    {
      "code":101,
      "type":"SINGLE"
    },
    {
      "code":96,
      "type":"SINGLE"
    },
    {
      "code":18,
      "type":"SINGLE"
    }
  ]
}