{
  "comment":"trial template for contrast tm file and contrast cnd file",
  "startcode":9,
  "stopcode":18,
  "rewardcode":96,
  "codes":[
    {
      "code":9,
      "type":"SINGLE"
    },
    {
      "code":10,
      "type":"SINGLE"
    },
    {
      "code":15,
      "type":"SINGLE"
    },
    {
      "missable":false,
      "max_value":171,
      "min_value":140,
      "type":"RANGE"
    },
    {
      "code":100,
      "type":"SINGLE"
    },
    {
      "code":16,
      "type":"SINGLE"
    },
    {
      "code":23,
      "type":"SINGLE"
    },
    {
      "code":8,
      "type":"SINGLE"
    },
    {
      "code":33,
      "type":"SINGLE"
    },
    {
      "code":31,
      "type":"SINGLE"
    },
    {
      "missable":false,
      "max_value":123,
      "min_value":121,
      "type":"RANGE"
    },
    {
      "code":120,
      "type":"SINGLE"
    },
    {
      "code":11,
      "type":"SINGLE"
    },
    {
      "code":8,
      "type":"SINGLE"
    },
    {
      "code":31,
      "type":"SINGLE"
    },
    {
      "code":24,
      "type":"SINGLE"
    },
    {
      "code":17,
      "type":"SINGLE"
    },
    {
      "code":101,
      "type":"SINGLE"
    },
    {
      "code":96,
      "type":"SINGLE"
    },
    {
      "code":18,
      "type":"SINGLE"
    }
  ]
}